{
  "id": "tidebound-blade",
  "name": "Tidebound Blade",
  "familyId": "tidebound",
  "dungeonId": "gravehollow-keep",
  "zoneId": "the-drowned-vault",
  "role": "fodder",
  "size": "medium",
  "rows": [
    "front"
  ],
  "levelBand": {
    "min": 11,
    "max": 11
  },
  "multipliers": {
    "hp": 1,
    "attack": 1.2,
    "defense": 0.9
  },
  "speed": 120,
  "xpClass": 1,
  "goldMultiplier": 1.2,
  "ambushModifier": 5,
  "attacks": [
    {
      "id": "hook-pair",
      "name": "Hook Pair",
      "damageType": "slash",
      "weight": 800,
      "multiplier": 0.7,
      "target": "enemyFront",
      "effects": [
        {
          "kind": "applyStatus",
          "status": "bleed",
          "chance": 30,
          "duration": 2
        },
        {
          "kind": "damage",
          "multiplier": 0.7,
          "damageType": "slash",
          "note": "the second hook"
        },
        {
          "kind": "applyStatus",
          "status": "bleed",
          "chance": 30,
          "duration": 2
        }
      ],
      "aiWeight": 65,
      "tell": null
    },
    {
      "id": "gut-hook",
      "name": "Gut Hook",
      "damageType": "pierce",
      "weight": 1000,
      "multiplier": 1.3,
      "target": "enemyFront",
      "effects": [
        {
          "kind": "applyStatus",
          "status": "bleed",
          "duration": 3
        }
      ],
      "aiWeight": 35,
      "tell": null
    }
  ],
  "resist": [
    "frost"
  ],
  "weak": [
    "lightning"
  ],
  "immune": [],
  "statusImmune": [],
  "behavior": {
    "rules": [
      {
        "if": "attacks the hero with the lowest Defense in reach — under Fortify it stops dodging and attacks twice",
        "then": "hook-pair"
      }
    ],
    "fleesAtPercent": 0
  },
  "parts": {
    "common": {
      "materialId": "steel",
      "chance": 35,
      "quantity": {
        "min": 1,
        "max": 1
      }
    },
    "rare": {
      "itemId": "tide-glass",
      "chance": 4,
      "quantity": {
        "min": 1,
        "max": 1
      }
    },
    "breakLimb": {
      "name": "hook hand",
      "effect": {
        "kind": "debuffStat",
        "stat": "attackPhys",
        "percent": -30,
        "note": "one hook left (Hook Pair loses its second hit; read as Attack −30%)"
      }
    }
  },
  "monsterTechniqueSkillIds": [],
  "elitePool": [
    "shielded",
    "vampiric",
    "shackler",
    "rabid",
    "spiteful",
    "warded",
    "thorned",
    "regenerating",
    "mirrored",
    "commander",
    "leech",
    "nullifier"
  ],
  "boss": null,
  "hunter": null,
  "visual": {
    "baseMesh": "humanoid",
    "scale": 1,
    "variantOf": "grinning-cutpurse",
    "palette": [
      "#7f8a8c",
      "#8b4a2b",
      "#3d5aa8"
    ],
    "reads200px": true,
    "animations": [
      "Idle",
      "Move",
      "Attack1",
      "Attack2",
      "Hit",
      "Death",
      "DualAttack"
    ],
    "triBudget": 3500
  }
}
